{
  "schema": "code-audit-framework/report@1",
  "generated_at": "2026-06-13T17:21:04+00:00",
  "run_dir": "/Users/stephencheng/Projects/Personal/my-cv",
  "protocol_version": "v1.5.0",
  "protected_areas": [
    "src/data/"
  ],
  "loops": [
    {
      "loop": 1,
      "date": "2026-06-14",
      "protocol": "v1.5.0",
      "mode": "autonomous",
      "approved": null,
      "no_significant_findings": true,
      "tasks": []
    }
  ],
  "metrics": [],
  "summary": {
    "loops": 1,
    "tasks": 0,
    "tasks_by_status": {},
    "tasks_by_severity": {},
    "metrics_measured": 0,
    "violations": 0,
    "violations_by_code": {},
    "clean": true,
    "waived": 0
  },
  "violations": [],
  "waived": []
}
