{
  "schema": "code-audit-framework/report@1",
  "generated_at": "2026-06-12T18:25:58+00:00",
  "run_dir": "/Users/stephencheng/Projects/Personal/3d-preriodic-table",
  "protocol_version": "v1.3.0",
  "protected_areas": [
    "src/data/"
  ],
  "loops": [
    {
      "loop": 1,
      "date": "2026-06-12",
      "protocol": "v1.3.0",
      "mode": "gated",
      "approved": [
        "L1-T1"
      ],
      "no_significant_findings": true,
      "tasks": [
        {
          "id": "L1-T1",
          "severity": "High",
          "status": "DONE",
          "vector": "Testing",
          "description": "npm run test was **red** (1/11): src/App.test.tsx renders <App> \u2192 DashboardLayout.tsx:43 reads localStorage.getItem('theme') unguarded during useState init, and localStorage is undefined in that test render \u2192 TypeError. \u2192 Guard the read (typeof localStorage !== 'undefined'). \u0394: suite 11/11 green. Done (2026-06-12): guarded the read in the useState initializer AND the setItem in the theme useEffect; suite 10\u219211 passed (see execution results). Also closes the below-floor SSR L item.",
          "verify": "npm run test (0 failures)"
        }
      ]
    }
  ],
  "metrics": [],
  "summary": {
    "loops": 1,
    "tasks": 1,
    "tasks_by_status": {
      "DONE": 1
    },
    "tasks_by_severity": {
      "High": 1
    },
    "metrics_measured": 0,
    "violations": 0,
    "violations_by_code": {},
    "clean": true,
    "waived": 0
  },
  "violations": [],
  "waived": []
}
